analisis_salud_mexico_compuesto/tabla_anova_indices_compuestos.csv

factor,suma_cuadrados,gl,estadistico_f,p_valor
indice_sueno_salud_mental,3279280.7664436866,1.0,118759.94438083863,0.0
indice_actividad_corporal,3169934.5696895584,1.0,114799.94547569472,0.0
indice_habitos_saludables,1399066.3388716248,1.0,50667.525113955795,0.0
indice_contexto_socioambiental,700762.59352621,1.0,25378.28644712178,0.0
indice_carga_clinica,6827857.415857702,1.0,247272.50415551814,0.0
Residual,2070785.592573559,74994.0,,

analisis_salud_mexico_compuesto/resumen_indices_compuestos.md

## ANOVA

- indice_carga_clinica: F=247272.5042, p=0.0
- indice_sueno_salud_mental: F=118759.9444, p=0.0
- indice_actividad_corporal: F=114799.9455, p=0.0
- indice_habitos_saludables: F=50667.5251, p=0.0
- indice_contexto_socioambiental: F=25378.2864, p=0.0